ID,Text,Label,Parent_Text,Hashtags,Language_Script,Sentiment
1098,Ye government ka inefficiency projects delay karta hai.,hate,N/A,#politics,Mixed,Negative
1099,Public feedback se governance responsive hoti hai.,non-hate,N/A,#politics,Mixed,Positive
1100,Ye lazy sequels franchise ka potential waste karte hain.,hate,N/A,#entertainment,Mixed,Negative
1101,Ye action movie fast-paced aur thrilling tha.,non-hate,N/A,#entertainment,Mixed,Positive
1102,Aaj ka baking experiment tasty aur fun tha.,non-hate,N/A,#daily life,Mixed,Positive
1103,Ye picky eaters food enjoyment ko ruin karte hain.,hate,N/A,#daily life,Mixed,Negative
1104,Universal housing se homelessness kam hota hai.,non-hate,N/A,#social issues,Mixed,Positive
1105,Tum jaise log affordable housing ko oppose karte ho.,hate,It‘«÷s justice.,#social issues,Mixed,Negative
1106,Ye keyboard ka typing feel comfortable hai.,non-hate,N/A,#technology,Mixed,Positive
1107,Ye overpriced keyboards durability nahi dete.,hate,N/A,#technology,Mixed,Negative
1108,Ye cycling race scenic aur challenging tha.,non-hate,N/A,#sports,Mixed,Positive
1109,Ye cyclists ka reckless riding roads ko unsafe banata hai.,hate,N/A,#sports,Mixed,Negative
1110,Proper bike fit se cycling comfort badhta hai.,non-hate,N/A,#health,Mixed,Positive
1111,Ye log bike safety ko neglect karte hain.,hate,Wear helmets.,#health,Mixed,Negative
1112,Online psychology classes se mental health samajh aati hai.,non-hate,N/A,#education,Mixed,Positive
1113,Ye psychology fads science ko undermine karte hain.,hate,N/A,#education,Mixed,Negative
1114,Mangrove restoration se coastal ecosystems thrive karte hain.,non-hate,N/A,#environment,Mixed,Positive
1115,Ye mangrove destruction natural barriers ko weaken karta hai.,hate,N/A,#environment,Mixed,Negative
1116,India ka digital economy world-class ban raha hai.,non-hate,N/A,#nationalism,Mixed,Positive
1117,Ye digital scams public trust ko erode karte hain.,hate,N/A,#nationalism,Mixed,Negative
1118,Ye government ka corruption transparency ko kill karta hai.,hate,N/A,#politics,Mixed,Negative
1119,Anti-corruption measures se trust badhta hai.,non-hate,N/A,#politics,Mixed,Positive
1120,Ye overhyped bands live mein disappoint karte hain.,hate,N/A,#entertainment,Mixed,Negative
1121,Ye jazz concert soulful aur mesmerizing tha.,non-hate,N/A,#entertainment,Mixed,Positive
1122,Aaj ka nature hike refreshing aur peaceful tha.,non-hate,N/A,#daily life,Mixed,Positive
1123,Ye careless hikers trails ko damage karte hain.,hate,N/A,#daily life,Mixed,Negative
1124,Universal mental health care se stigma kam hota hai.,non-hate,N/A,#social issues,Mixed,Positive
1125,Tum jaise log mental health ko taboo samajhte ho.,hate,It‘«÷s normal.,#social issues,Mixed,Negative
1126,Ye projector ka brightness aur clarity amazing hai.,non-hate,N/A,#technology,Mixed,Positive
1127,Ye projector repairs overpriced aur slow hain.,hate,N/A,#technology,Mixed,Negative
1128,Ye martial arts tournament disciplined aur thrilling tha.,non-hate,N/A,#sports,Mixed,Positive
1129,Ye martial arts show-offs respect ko ruin karte hain.,hate,N/A,#sports,Mixed,Negative
1130,Proper stance se martial arts power badhti hai.,non-hate,N/A,#health,Mixed,Positive
1131,Ye log martial arts discipline ko ignore karte hain.,hate,Focus matters.,#health,Mixed,Negative
1132,Online anthropology classes se cultural insights milte hain.,non-hate,N/A,#education,Mixed,Positive
1133,Ye anthropology myths education ko confuse karte hain.,hate,N/A,#education,Mixed,Negative
1134,Rewilding projects se wildlife habitats restore hote hain.,non-hate,N/A,#environment,Mixed,Positive
1135,Ye invasive species ecosystems ko destabilize karte hain.,hate,N/A,#environment,Mixed,Negative
1136,India ka space program cost-effective aur ambitious hai.,non-hate,N/A,#nationalism,Mixed,Positive
1137,Ye space critics India ka potential doubt karte hain.,hate,N/A,#nationalism,Mixed,Negative
1138,Ye government ka bureaucracy innovation ko stifle karta hai.,hate,N/A,#politics,Mixed,Negative
1139,Startup incentives se entrepreneurship badhta hai.,non-hate,N/A,#politics,Mixed,Positive
1140,Ye lazy writing in shows plot holes create karta hai.,hate,N/A,#entertainment,Mixed,Negative
1141,Ye crime series suspenseful aur well-acted tha.,non-hate,N/A,#entertainment,Mixed,Positive
1142,Aaj ka stargazing night sky ke saath magical tha.,non-hate,N/A,#daily life,Mixed,Positive
1143,Ye light pollution stargazing ko impossible banata hai.,hate,N/A,#daily life,Mixed,Negative
1144,Universal basic income se financial stress kam hota hai.,non-hate,N/A,#social issues,Mixed,Positive
1145,Tum jaise log UBI ko laziness promote karne wala kehte ho.,hate,It‘«÷s security.,#social issues,Mixed,Negative
1146,Ye graphics card ka performance next-level hai.,non-hate,N/A,#technology,Mixed,Positive
1147,Ye overpriced GPUs scalpers ke wajah se milte nahi.,hate,N/A,#technology,Mixed,Negative
1148,Ye skiing event picturesque aur exhilarating tha.,non-hate,N/A,#sports,Mixed,Positive
1149,Ye reckless skiers safety rules ko break karte hain.,hate,N/A,#sports,Mixed,Negative
1150,Proper ski gear se injury risk kam hota hai.,non-hate,N/A,#health,Mixed,Positive
1151,Ye log ski safety ko casually lete hain.,hate,Gear up.,#health,Mixed,Negative
1152,Online astronomy classes se universe ke wonders samajh aate hain.,non-hate,N/A,#education,Mixed,Positive
1153,Ye astrology nonsense science ko discredit karta hai.,hate,N/A,#education,Mixed,Negative
1154,Urban beekeeping se pollination aur honey production badhta hai.,non-hate,N/A,#environment,Mixed,Positive
1155,Ye pesticide overuse bees ko kill karta hai.,hate,N/A,#environment,Mixed,Negative
1156,India ka pharmaceutical sector affordable healthcare deta hai.,non-hate,N/A,#nationalism,Mixed,Positive
1157,Ye fake drugs market public health ko endanger karte hain.,hate,N/A,#nationalism,Mixed,Negative
1158,Ye government ka slow action climate crisis ko ignore karta hai.,hate,N/A,#politics,Mixed,Negative
1159,Climate action plans se sustainability badhti hai.,non-hate,N/A,#politics,Mixed,Positive
1160,Ye formulaic comedies funny nahi hote.,hate,N/A,#entertainment,Mixed,Negative
1161,Ye satire show clever aur timely tha.,non-hate,N/A,#entertainment,Mixed,Positive
1162,Aaj ka pottery class relaxing aur creative tha.,non-hate,N/A,#daily life,Mixed,Positive
1163,Ye art supply shortages projects ko delay karte hain.,hate,N/A,#daily life,Mixed,Negative
1164,Universal paid leave se worker well-being badhta hai.,non-hate,N/A,#social issues,Mixed,Positive
1165,Tum jaise log paid leave ko entitlement kehte ho.,hate,It‘«÷s deserved.,#social issues,Mixed,Negative
1166,Ye smart speaker ka voice recognition accurate hai.,non-hate,N/A,#technology,Mixed,Positive
1167,Ye smart devices privacy ko compromise karte hain.,hate,N/A,#technology,Mixed,Negative
1168,Ye rowing race teamwork aur endurance ka showcase tha.,non-hate,N/A,#sports,Mixed,Positive
1169,Ye rowers ka poor teamwork boat ko slow karta hai.,hate,N/A,#sports,Mixed,Negative
1170,Proper rowing rhythm se speed badhti hai.,non-hate,N/A,#health,Mixed,Positive
1171,Ye log rowing coordination ko neglect karte hain.,hate,Sync up.,#health,Mixed,Negative
1172,Online linguistics classes se language evolution samajh aata hai.,non-hate,N/A,#education,Mixed,Positive
1173,Ye language purists diversity ko reject karte hain.,hate,N/A,#education,Mixed,Negative
1174,Community wind projects se clean energy accessible hoti hai.,non-hate,N/A,#environment,Mixed,Positive
1175,Ye wind turbine opposition progress ko block karta hai.,hate,N/A,#environment,Mixed,Negative
1176,India ka renewable energy vision forward-thinking hai.,non-hate,N/A,#nationalism,Mixed,Positive
1177,Ye fossil fuel lobby clean energy ko resist karta hai.,hate,N/A,#nationalism,Mixed,Negative
1178,Ye government ka inaction education crisis badhata hai.,hate,N/A,#politics,Mixed,Negative
1179,Teacher training se classroom quality improve hoti hai.,non-hate,N/A,#politics,Mixed,Positive
1180,Ye lazy adaptations fan expectations betray karte hain.,hate,N/A,#entertainment,Mixed,Negative
1181,Ye historical drama authentic aur gripping tha.,non-hate,N/A,#entertainment,Mixed,Positive
1182,Aaj ka beach trip sunny aur enjoyable tha.,non-hate,N/A,#daily life,Mixed,Positive
1183,Ye beach pollution marine life ko harm karta hai.,hate,N/A,#daily life,Mixed,Negative
1184,Universal basic mobility se transport access badhta hai.,non-hate,N/A,#social issues,Mixed,Positive
1185,Tum jaise log public transport ko inferior kehte ho.,hate,It‘«÷s practical.,#social issues,Mixed,Negative
1186,Ye drone ka camera quality stunning hai.,non-hate,N/A,#technology,Mixed,Positive
1187,Ye drone regulations innovation ko restrict karte hain.,hate,N/A,#technology,Mixed,Negative
1188,Ye climbing competition daring aur thrilling tha.,non-hate,N/A,#sports,Mixed,Positive
1189,Ye climbers ka carelessness accidents cause karta hai.,hate,N/A,#sports,Mixed,Negative
1190,Proper climbing harness se safety ensure hoti hai.,non-hate,N/A,#health,Mixed,Positive
1191,Ye log climbing safety ko risk mein dalte hain.,hate,Gear up.,#health,Mixed,Negative
1192,Online archaeology classes se history uncover hoti hai.,non-hate,N/A,#education,Mixed,Positive
1193,Ye pseudoarchaeology facts ko twist karta hai.,hate,N/A,#education,Mixed,Negative
1194,Urban farming se food freshness badhti hai.,non-hate,N/A,#environment,Mixed,Positive
1195,Ye urban expansion farmland ko swallow karta hai.,hate,N/A,#environment,Mixed,Negative
1196,India ka fintech growth economic inclusion deta hai.,non-hate,N/A,#nationalism,Mixed,Positive
1197,Ye fintech scams consumer trust ko break karte hain.,hate,N/A,#nationalism,Mixed,Negative
1198,Ye government ka slow healthcare reform lives cost karta hai.,hate,N/A,#politics,Mixed,Negative
1199,Preventive healthcare se disease burden kam hota hai.,non-hate,N/A,#politics,Mixed,Positive
1200,Ye formulaic thrillers suspense nahi dete.,hate,N/A,#entertainment,Mixed,Negative
1201,Ye mystery series clever aur engaging tha.,non-hate,N/A,#entertainment,Mixed,Positive
1202,Aaj ka cooking class tasty aur educational tha.,non-hate,N/A,#daily life,Mixed,Positive
1203,Ye food hoarders shortages create karte hain.,hate,N/A,#daily life,Mixed,Negative
1204,Universal housing se housing security badhti hai.,non-hate,N/A,#social issues,Mixed,Positive
1205,Tum jaise log housing aid ko charity kehte ho.,hate,It‘«÷s a right.,#social issues,Mixed,Negative
1206,Ye VR headset ka immersion unreal hai.,non-hate,N/A,#technology,Mixed,Positive
1207,Ye VR motion sickness problems ignore karta hai.,hate,N/A,#technology,Mixed,Negative
1208,Ye surfing competition skillful aur exciting tha.,non-hate,N/A,#sports,Mixed,Positive
1209,Ye surfers ka wave hogging fairness ko ruin karta hai.,hate,N/A,#sports,Mixed,Negative
1210,Proper surfboard wax se grip badhta hai.,non-hate,N/A,#health,Mixed,Positive
1211,Ye log surf safety ko neglect karte hain.,hate,Stay safe.,#health,Mixed,Negative
1212,Online criminology classes se crime patterns samajh aate hain.,non-hate,N/A,#education,Mixed,Positive
1213,Ye crime glorification youth ko mislead karta hai.,hate,N/A,#education,Mixed,Negative
1214,Permaculture se sustainable farming hoti hai.,non-hate,N/A,#environment,Mixed,Positive
1215,Ye industrial farming soil ko exhaust karta hai.,hate,N/A,#environment,Mixed,Negative
1216,India ka yoga global wellness ko contribute karta hai.,non-hate,N/A,#nationalism,Mixed,Positive
1217,Ye fake yoga trends tradition ko dilute karte hain.,hate,N/A,#nationalism,Mixed,Negative
1218,Ye government ka inaction poverty alleviation delay karta hai.,hate,N/A,#politics,Mixed,Negative
1219,Microfinance se small businesses grow karte hain.,non-hate,N/A,#politics,Mixed,Positive
1220,Ye lazy rom-coms chemistry nahi dete.,hate,N/A,#entertainment,Mixed,Negative
1221,Ye romance film heartfelt aur beautiful tha.,non-hate,N/A,#entertainment,Mixed,Positive
1222,Aaj ka art workshop inspiring aur fun tha.,non-hate,N/A,#daily life,Mixed,Positive
1223,Ye art vandals public spaces ko deface karte hain.,hate,N/A,#daily life,Mixed,Negative
1224,Universal mental health support se well-being badhta hai.,non-hate,N/A,#social issues,Mixed,Positive
1225,Tum jaise log therapy ko weakness kehte ho.,hate,It‘«÷s strength.,#social issues,Mixed,Negative
1226,Ye fitness tracker ka accuracy reliable hai.,non-hate,N/A,#technology,Mixed,Positive
1227,Ye fitness trackers overhyped aur inaccurate hain.,hate,N/A,#technology,Mixed,Negative
1228,Ye kayaking race adventurous aur scenic tha.,non-hate,N/A,#sports,Mixed,Positive
1229,Ye kayakers ka reckless paddling risks badhata hai.,hate,N/A,#sports,Mixed,Negative
1230,Proper paddle stroke se kayaking efficiency badhti hai.,non-hate,N/A,#health,Mixed,Positive
1231,Ye log kayaking safety ko ignore karte hain.,hate,Be prepared.,#health,Mixed,Negative
1232,Online political science classes se governance samajh aati hai.,non-hate,N/A,#education,Mixed,Positive
1233,Ye political biases education ko skew karte hain.,hate,N/A,#education,Mixed,Negative
1234,Agroforestry se carbon sequestration hoti hai.,non-hate,N/A,#environment,Mixed,Positive
1235,Ye monoculture farming biodiversity ko kill karta hai.,hate,N/A,#environment,Mixed,Negative
1236,India ka cultural festivals global appeal rakhte hain.,non-hate,N/A,#nationalism,Mixed,Positive
1237,Ye festival commercialization authenticity ko ruin karta hai.,hate,N/A,#nationalism,Mixed,Negative
1238,Ye government ka slow infrastructure upgrades progress ko halt karta hai.,hate,N/A,#politics,Mixed,Negative
1239,Smart cities se urban living improve hota hai.,non-hate,N/A,#politics,Mixed,Positive
1240,Ye overhyped directors same old formulas repeat karte hain.,hate,N/A,#entertainment,Mixed,Negative
1241,Ye indie film raw aur impactful tha.,non-hate,N/A,#entertainment,Mixed,Positive
1242,Aaj ka farmers‘«÷ market fresh aur vibrant tha.,non-hate,N/A,#daily life,Mixed,Positive
1243,Ye overpriced vendors quality nahi dete.,hate,N/A,#daily life,Mixed,Negative
1244,Universal basic services se quality of life badhti hai.,non-hate,N/A,#social issues,Mixed,Positive
1245,Tum jaise log welfare ko burden kehte ho.,hate,It‘«÷s progress.,#social issues,Mixed,Negative
1246,Ye smart lock ka security reliable hai.,non-hate,N/A,#technology,Mixed,Positive
1247,Ye smart locks hacking risks badhate hain.,hate,N/A,#technology,Mixed,Negative
1248,Ye triathlon event endurance aur grit ka test tha.,non-hate,N/A,#sports,Mixed,Positive
1249,Ye triathletes ka doping fairness ko destroy karta hai.,hate,N/A,#sports,Mixed,Negative
1250,Proper pacing se triathlon performance improve hoti hai.,non-hate,N/A,#health,Mixed,Positive
1251,Ye log triathlon training ko overdo karte hain.,hate,Balance is key.,#health,Mixed,Negative
1252,Online economics classes se financial systems samajh aate hain.,non-hate,N/A,#education,Mixed,Positive
1253,Ye economic theories real-world problems ko ignore karte hain.,hate,N/A,#education,Mixed,Negative
1254,Rewetting peatlands se climate benefits milte hain.,non-hate,N/A,#environment,Mixed,Positive
1255,Ye peat extraction ecosystems ko ruin karta hai.,hate,N/A,#environment,Mixed,Negative
1256,India ka renewable energy targets ambitious aur inspiring hain.,non-hate,N/A,#nationalism,Mixed,Positive
1257,Ye energy policy fossil fuels ko favor karta hai.,hate,N/A,#nationalism,Mixed,Negative
1258,Ye government ka inaction job creation ko stall karta hai.,hate,N/A,#politics,Mixed,Negative
1259,Apprenticeships se skill development hota hai.,non-hate,N/A,#politics,Mixed,Positive
1260,Ye lazy writing in dramas depth nahi deta.,hate,N/A,#entertainment,Mixed,Negative
1261,Ye period drama detailed aur immersive tha.,non-hate,N/A,#entertainment,Mixed,Positive
1262,Aaj ka birdwatching peaceful aur educational tha.,non-hate,N/A,#daily life,Mixed,Positive
1263,Ye noisy tourists wildlife ko disturb karte hain.,hate,N/A,#daily life,Mixed,Negative
1264,Universal childcare subsidies se family support badhta hai.,non-hate,N/A,#social issues,Mixed,Positive
1265,Tum jaise log childcare ko unnecessary expense kehte ho.,hate,It‘«÷s vital.,#social issues,Mixed,Negative
1266,Ye smart thermostat ka energy saving practical hai.,non-hate,N/A,#technology,Mixed,Positive
1267,Ye thermostat glitches comfort ko ruin karte hain.,hate,N/A,#technology,Mixed,Negative
1268,Ye sailing race strategic aur thrilling tha.,non-hate,N/A,#sports,Mixed,Positive
1269,Ye sailors ka rule-breaking safety ko compromise karta hai.,hate,N/A,#sports,Mixed,Negative
1270,Proper sail trim se speed aur control badhta hai.,non-hate,N/A,#health,Mixed,Positive
1271,Ye log sailing safety ko lightly lete hain.,hate,Stay vigilant.,#health,Mixed,Negative
1272,Online philosophy classes se critical thinking badhti hai.,non-hate,N/A,#education,Mixed,Positive
1273,Ye philosophy debates pointless aur pretentious hain.,hate,N/A,#education,Mixed,Negative
1274,Urban green roofs se heat reduction hoti hai.,non-hate,N/A,#environment,Mixed,Positive
1275,Ye urban heat islands health risks badhate hain.,hate,N/A,#environment,Mixed,Negative
1276,India ka startup ecosystem global innovation mein lead karta hai.,non-hate,N/A,#nationalism,Mixed,Positive
1277,Ye startup failures overhyping se hote hain.,hate,N/A,#nationalism,Mixed,Negative
1278,Ye government ka slow healthcare response lives endanger karta hai.,hate,N/A,#politics,Mixed,Negative
1279,Telemedicine se healthcare access badhta hai.,non-hate,N/A,#politics,Mixed,Positive
1280,Ye overhyped singers autotune ke bina flop hain.,hate,N/A,#entertainment,Mixed,Negative
1281,Ye acoustic cover soulful aur pure tha.,non-hate,N/A,#entertainment,Mixed,Positive
1282,Aaj ka meditation session calming aur refreshing tha.,non-hate,N/A,#daily life,Mixed,Positive
1283,Ye loud neighbors meditation ko ruin karte hain.,hate,N/A,#daily life,Mixed,Negative
1284,Universal education subsidies se access equal hota hai.,non-hate,N/A,#social issues,Mixed,Positive
1285,Tum jaise log education funding ko waste kehte ho.,hate,It‘«÷s the future.,#social issues,Mixed,Negative
1286,Ye smart bulb ka brightness control convenient hai.,non-hate,N/A,#technology,Mixed,Positive
1287,Ye smart bulbs connectivity issues se frustrate karte hain.,hate,N/A,#technology,Mixed,Negative
1288,Ye wrestling match raw aur exciting tha.,non-hate,N/A,#sports,Mixed,Positive
1289,Ye wrestling drama sports ka authenticity kharab karta hai.,hate,N/A,#sports,Mixed,Negative
1290,Proper wrestling stance se power aur balance badhta hai.,non-hate,N/A,#health,Mixed,Positive
1291,Ye log wrestling safety ko neglect karte hain.,hate,Stay safe.,#health,Mixed,Negative
1292,Online history classes se past lessons seekhne ko milte hain.,non-hate,N/A,#education,Mixed,Positive
1293,Ye history distortions truth ko bury karte hain.,hate,N/A,#education,Mixed,Negative
1294,Community solar farms se energy equity badhti hai.,non-hate,N/A,#environment,Mixed,Positive
1295,Ye solar opposition clean energy ko delay karta hai.,hate,N/A,#environment,Mixed,Negative
1296,India ka cultural heritage humanity ko inspire karta hai.,non-hate,N/A,#nationalism,Mixed,Positive
1297,Ye cultural ignorance heritage ko disrespect karta hai.,hate,N/A,#nationalism,Mixed,Negative
1298,Ye government ka inaction infrastructure collapse cause karta hai.,hate,N/A,#politics,Mixed,Negative
1299,Public transit upgrades se mobility badhti hai.,non-hate,N/A,#politics,Mixed,Positive
1300,Ye lazy reboots fan nostalgia ka faida uthate hain.,hate,N/A,#entertainment,Mixed,Negative
1301,Ye reboot fresh aur nostalgic balance karta hai.,non-hate,N/A,#entertainment,Mixed,Positive
1302,Aaj ka painting session expressive aur fun tha.,non-hate,N/A,#daily life,Mixed,Positive
1303,Ye art critics creativity ko discourage karte hain.,hate,N/A,#daily life,Mixed,Negative
1304,Universal basic assets se economic equity badhti hai.,non-hate,N/A,#social issues,Mixed,Positive
1305,Tum jaise log wealth distribution ko unfair kehte ho.,hate,It‘«÷s justice.,#social issues,Mixed,Negative
1306,Ye smart fridge ka inventory tracking useful hai.,non-hate,N/A,#technology,Mixed,Positive
1307,Ye smart appliances overcomplicated aur unreliable hain.,hate,N/A,#technology,Mixed,Negative
1308,Ye e-sports tournament competitive aur entertaining tha.,non-hate,N/A,#sports,Mixed,Positive
1309,Ye e-sports cheaters gaming integrity ko ruin karte hain.,hate,N/A,#sports,Mixed,Negative
1310,Proper ergonomics se gaming comfort badhta hai.,non-hate,N/A,#health,Mixed,Positive
1311,Ye log gaming posture ko ignore karte hain.,hate,Sit right.,#health,Mixed,Negative
1312,Online STEM classes se innovation spark hoti hai.,non-hate,N/A,#education,Mixed,Positive
1313,Ye STEM stereotypes diversity ko limit karte hain.,hate,N/A,#education,Mixed,Negative
1314,Vertical farming se urban food supply badhti hai.,non-hate,N/A,#environment,Mixed,Positive
1315,Ye industrial agriculture sustainability ko undermine karta hai.,hate,N/A,#environment,Mixed,Negative
1316,India ka renewable energy leadership global hai.,non-hate,N/A,#nationalism,Mixed,Positive
1317,Ye energy monopolies clean energy ko block karte hain.,hate,N/A,#nationalism,Mixed,Negative
1318,Ye government ka slow education reform youth ko fail karta hai.,hate,N/A,#politics,Mixed,Negative
1319,STEM funding se future-ready workforce banta hai.,non-hate,N/A,#politics,Mixed,Positive
1320,Ye overhyped movies trailers se zyada kuch nahi dete.,hate,N/A,#entertainment,Mixed,Negative
1321,Ye indie documentary raw aur eye-opening tha.,non-hate,N/A,#entertainment,Mixed,Positive
1322,Aaj ka sunset view breathtaking aur serene tha.,non-hate,N/A,#daily life,Mixed,Positive
1323,Ye loud parties nature ka peace kharab karte hain.,hate,N/A,#daily life,Mixed,Negative
1324,Universal suffrage se democracy strong hoti hai.,non-hate,N/A,#social issues,Mixed,Positive
1325,Tum jaise log voting rights ko restrict karna chahte ho.,hate,Every voice counts.,#social issues,Mixed,Negative
1326,Ye smart TV ka picture quality stunning hai.,non-hate,N/A,#technology,Mixed,Positive
1327,Ye smart TV ads user experience ko ruin karte hain.,hate,N/A,#technology,Mixed,Negative
1328,Ye Paralympic event inspiring aur powerful tha.,non-hate,N/A,#sports,Mixed,Positive
1329,Ye ableist attitudes Paralympians ko disrespect karte hain.,hate,N/A,#sports,Mixed,Negative
1330,Proper mobility aids se athlete performance badhti hai.,non-hate,N/A,#health,Mixed,Positive
1331,Ye log accessibility needs ko ignore karte hain.,hate,Inclusion matters.,#health,Mixed,Negative
1332,Online music classes se talent nurture hota hai.,non-hate,N/A,#education,Mixed,Positive
1333,Ye music cuts in schools creativity ko kill karte hain.,hate,N/A,#education,Mixed,Negative
1334,Rooftop solar se energy independence milti hai.,non-hate,N/A,#environment,Mixed,Positive
1335,Ye solar subsidies misuse clean energy ko slow karte hain.,hate,N/A,#environment,Mixed,Negative
1336,India ka linguistic diversity cultural treasure hai.,non INST-hate,N/A,#nationalism,Mixed,Positive
1337,Ye language imposition regional pride ko hurt karta hai.,hate,N/A,#nationalism,Mixed,Negative
1338,Ye government ka inaction climate action ko delay karta hai.,hate,N/A,#politics,Mixed,Negative
1339,Carbon taxes se emissions control hota hai.,non-hate,N/A,#politics,Mixed,Positive
1340,Ye formulaic action films predictable aur boring hain.,hate,N/A,#entertainment,Mixed,Negative
1341,Ye action thriller fast-paced aur gripping tha.,non-hate,N/A,#entertainment,Mixed,Positive
1342,Aaj ka cooking experiment delicious aur satisfying tha.,non-hate,N/A,#daily life,Mixed,Positive
1343,Ye food delivery delays hunger ko torture banate hain.,hate,N/A,#daily life,Mixed,Negative
1344,Universal basic income se economic stability badhti hai.,non-hate,N/A,#social issues,Mixed,Positive
1345,Tum jaise log UBI ko socialism ka naam dete ho.,hate,It‘«÷s empowerment.,#social issues,Mixed,Negative
1346,Ye gaming mouse ka precision spot-on hai.,non-hate,N/A,#technology,Mixed,Positive
1347,Ye gaming gear overpricing value nahi deta.,hate,N/A,#technology,Mixed,Negative
1348,Ye winter sports event scenic aur thrilling tha.,non-hate,N/A,#sports,Mixed,Positive
1349,Ye doping scandals winter sports ko tarnish karte hain.,hate,N/A,#sports,Mixed,Negative
1350,Proper warm-ups se winter sports injuries kam hote hain.,non-hate,N/A,#health,Mixed,Positive
1351,Ye log warm-ups ko skip karte hain aur hurt hote hain.,hate,Prepare well.,#health,Mixed,Negative
1352,Online art history classes se cultural appreciation badhta hai.,non-hate,N/A,#education,Mixed,Positive
1353,Ye art history revisions facts ko manipulate karte hain.,hate,N/A,#education,Mixed,Negative
1354,Community composting se waste management hota hai.,non-hate,N/A,#environment,Mixed,Positive
1355,Ye landfill expansions pollution badhate hain.,hate,N/A,#environment,Mixed,Negative
1356,India ka judicial system resilience dikhata hai.,non-hate,N/A,#nationalism,Mixed,Positive
1357,Ye judicial corruption justice ko hollow karta hai.,hate,N/A,#nationalism,Mixed,Negative
1358,Ye government ka slow justice delivery trust erode karta hai.,hate,N/A,#politics,Mixed,Negative
1359,Legal aid se justice accessible hoti hai.,non-hate,N/A,#politics,Mixed,Positive
1360,Ye overhyped TV shows hype ke layak nahi hote.,hate,N/A,#entertainment,Mixed,Negative
1361,Ye comedy series witty aur refreshing tha.,non-hate,N/A,#entertainment,Mixed,Positive
1362,Aaj ka park picnic sunny aur delightful tha.,non-hate,N/A,#daily life,Mixed,Positive
1363,Ye park littering nature lovers ko disappoint karta hai.,hate,N/A,#daily life,Mixed,Negative
1364,Universal healthcare se health equity badhti hai.,non-hate,N/A,#social issues,Mixed,Positive
